key	ru	en
Player_0_67718c73-1c86-424e-9b10-590e08c7ced4	<link=wave>... </link>	<link=wave>... </link>
Player_0_7b3b4f14-217c-4c55-bec8-1164cd00c894	А я... {playerName}!	And I... {playerName}!
Player_0_58a3e14c-03f6-48e1-8808-d1320e9726e6	Возможно это поможет!	Maybe this will help!
Player_0_957014cd-4aca-4266-9850-c58d84571706	Как я понимаю, это <link=hlight>осколок вашей души </link>.	As I understand it, this is <link=hlight>a fragment of your soul</link>.
Player_0_e7d38b8f-0733-4de8-9646-a53c7647eef5	Он появился, как только мы обнялись.	He appeared as soon as we hugged.
Player_0_a485d1bf-f0f1-4fe7-932a-716e5a457979	Да я сам только что узнал, если честно...	Well, I just found out myself, to be honest...
Player_1_3566a2bc-e923-4013-87cb-045e568692d8	Тертилус, а где мы?	Tertilus, where are we?
Player_1_a226d166-191a-4f04-be91-0ff5d8c9c70a	Ничего себе!	Wow!
Player_1_a5c14d48-562f-48f0-9dcd-7580f43bec89	Это же <link=hlight>ракушки</link>!	These are <link=hlight>shells</link>!
Player_1_f4d475ea-dc0d-4325-9c46-10d07a9e8214	Дом...	House...
Player_1_2a77703c-67a9-4292-9a4e-15882849720e	Хм, возможно я его смогу использовать.	Hmm, maybe I can use it.
Player_2_290fcc48-228f-48f1-b471-0a3b7aac9ab0	Да, это балгодаря тому осколку.	Yes, it is thanks to that fragment.
Player_2_c5737774-7c26-4504-9162-889a5a5d89c3	<link=wave>Не помню...</link>	<link=wave>I don't remember...</link>
Player_2_933627e3-d842-46c9-a142-d930ee613e2b	<link=wave>В-вы серьзено???</link>	<link=wave>A-are you serious???</link>
Player_3_4fd2d804-3d29-4a80-b7b6-8f1b62c3c8e2	<link=wave>ВА-А-А-А-АУ!</link>	<link=wave>WA-A-A-A-AU!</link>
Player_3_9ae625d4-bff4-4d9a-801a-d6c7d4b478bd	Большой Риф действительно БОЛЬШОЙ.	The Big Reef is really BIG.
Player_5_6e49980e-66d5-4ae4-aaa8-0fb0242a989e	Угу, меня зовут <link=wave>{playerName}</link>.	Uh-huh, my name is <link=wave>{playerName}</link>.
Player_5_fc73a50d-87e2-4d24-a55c-f5f05fce53d2	Призмы?	Prisms?
Player_5_f656b72d-fe15-4de9-9278-af44fa19dcbc	Хм, но ведь она должна что-то преломлять?	Hmm, but surely it must refract something?
Player_5_e7b5efd1-dbfd-4859-952c-73df5927c84c	Ох, то есть сейчас ваша звезда больше не светит?	Oh, so now your star is no longer shining?
Player_5_499c773a-8ea6-4fb0-aa48-3f2367e5b386	Я уверен, вы найдете способ согреться даже в самые холодные времена.	I'm sure you'll find a way to keep warm even in the coldest times.
Player_5_5a827ea5-6640-4378-8eb2-288fd3adeee0	Звучит как план!	Sounds like a plan!
Player_5_287158ce-e7a7-4bbf-bc0e-5ca8139c1146	Тогда скажи мне, где они примерно?	Then tell me where they are approximately?
Player_6_b9a9ed5c-3b5f-4f41-8cc6-2bc58f759643	Я всё сделал!	I did everything!
Player_6_f6e5ab6f-6a6b-47d5-aeef-82ca5df40a38	Это кто!?	Who is this!?
Player_6_b8b069b7-c301-462b-bce0-48664220f138	Уже есть прогресс!	There is already progress!
Player_7_2b4e5727-b9e7-4b59-bf84-7e9febf8ef90	Что случилось, Финикс?	What happened, Finix?
Player_7_feb02a28-8363-460c-a445-3c9aac92468a	Сто-о-о-ой...	St-o-o-o-p...
Player_9_334970d8-85c9-43a5-a413-c1ec23f93c1f	Вы очутились в искажении страха, Тертилус.	You find yourself in a distortion of fear, Tertilus.
Player_9_3232f50a-8f80-4b42-9269-9d13ebad19b0	Вы выбрались с моей помощью, а Финикс в это время ходила за помощью.	You got out with my help, and Finix went for help at that time.
Player_9_83b6f90e-a56c-43ef-95f0-20ad100e4050	Тогда до встреч, постараюсь так больше не влипать.	Then see you later, I'll try not to get into trouble like this again.
Player_9_72b4875e-2ff7-47a7-9c47-5f43a708487e	До новых встреч!	See you soon!
Player_9_2907c54e-eaf3-465f-b2a2-1f69fdf1bd93	Хм, так вот почему он меня смог приютить.	Hmm, so that's why he was able to take me in.
Player_9_dcf0fe78-8c6c-401d-9629-7f468f039021	Не благодари! Буду ждать, когда закончишь исследовать призму.	Don't thank me! I'll wait until you finish examining the prism.
Player_9_d3fb26a9-8789-4ed7-8972-490e61929cb2	Хм, спасибо за информацию.	Hmm, thanks for the information.
Player_9_d2c111d4-0231-4eee-b5f6-124f573cac78_0	Тертилус – староста?	Tertilus is the headman?
Player_9_d2c111d4-0231-4eee-b5f6-124f573cac78_1	А почему тот портал появился?	Why did that portal appear?
Player_9_d2c111d4-0231-4eee-b5f6-124f573cac78_2	<link=hlight>Слушай, на счёт призмы...</link>	<link=hlight>Listen, about the prism...</link>
Player_4_1d93d97a-80d5-475d-8fcd-c56e3b500964	Спасибо большое вам!	Thank you very much!
Player_4_0ba28b81-172c-40ea-a11b-084d3ed9ab62	Дом красивый, но пустоват.	The house is beautiful, but a bit empty.
Player_4_a8576663-394c-48ff-bd0a-2fdcd5d5071b	Ого, спасибо!	Wow, thank you!
Player_4_fd8b4f5e-7baf-4414-8090-a97c9a8a5516	До свидания!	Goodbye!
Player_100003_71c1ad68-f252-4488-bd07-8ed603a583e4	Он красивы-ы-ы-ый!	He is soooo beautiful!
Player_100003_35dc8826-d8db-49b0-80c3-b25094ac1839	Возможно туда можно поместить звёздную пыль.	Perhaps stardust could be placed there.
Player_100003_b0ef79ee-ee38-4dc2-98bd-c9a58ef08c89	Спасибо большое!	Thanks a lot!
Player_100003_d4677d19-ccf3-4341-8ef4-4445626db4fb	О-о-о, чувствую, как у меня восстанавливаются тепловые ядра.	Oh-oh-oh, I feel my thermal cores recovering.
Player_100003_d8fc2e70-ed76-4a03-b039-67a148ecea4b	Медленно, но верно.	Slowly but surely.
Player_100003_2603d2c3-b0e8-4a8a-9244-2258b7aad77c	До встречи, Тео!	See you later, Theo!
Player_100001_2e5924c6-3246-4854-af40-12c6b9998597	Привет, а что ты изучаешь?	Hi, what are you studying?
Player_100001_84fe8a60-23b7-4186-9bf0-aa8e97d0df1f	Прости, я не хотел...	I'm sorry, I didn't mean to...
Player_100001_76ea4629-e8c3-49e4-a97a-b8e1571ce745	Может я смогу чем-то помочь?	Maybe I can help with something?
Player_100001_14bd2442-800e-4877-b889-2fc7e285182e	Ого!	Wow!
Player_100001_c5fae32e-b7f6-459b-b3ae-143bb5505d97	Хорошо, я помогу!	Okay, I'll help!
Player_100001_3a53e8f8-4d10-44df-997d-344ba5893045	Ой, точно, а меня {playerName}.	Oh, right, and I'm {playerName}.
Player_100001_2616a8fb-9388-4f7e-8f07-2926a01c00a0_0	Что за коралловые статуи?	What are these coral statues?
Player_100001_2616a8fb-9388-4f7e-8f07-2926a01c00a0_1	<link=hlight>А зачем их изучать?</link>	<link=hlight>Why study them?</link>
Player_200001_9da1b4c4-c804-49a6-938d-486b9dc24c58	У вас всё нормально?	Are you okay?
Player_200001_665c08ef-71a7-4aed-b7e9-53b9984fc7df	Хорошо, а что у вас случилось, мистер ...	Okay, so what happened to you, Mister...
Player_200001_06497435-d61f-42b7-811a-61f520c8d34c	Что-то мне это напомнило... так в чём ваша беда!?	This reminded me of something... so what's your problem!?
Player_200001_6d16f2cf-accb-44f5-8f40-edc5252e5c5f	Хорошо, давайте помогу собрать товар.	Okay, let me help you assemble the goods.
Player_200002_5b4fd40e-5d3b-45b7-bb68-6723d3c255f6	{playerName}!	{playerName}!
Player_200002_4ce0624a-e07d-43e2-bd60-f77e6cef75a5	С радостью закуплюсь у вас, мистер Торвальд!	I'd be happy to buy from you, Mr. Torvald!
Player_200003_20b4d832-86ac-4bc6-bf64-6aac956607db	Да, конечно!	Yes, sure!
Player_200003_3bc69a8f-a280-4134-8d0c-949600765563	Это действительно впечатляет!	This is really impressive!
Player_200003_9e39c89b-9f6f-4ea0-8d1d-d7867b9771a6	Хотелось бы мне тоже такого друга...	I wish I had a friend like that too...
Player_200003_964e2803-3daa-420d-bbc5-e4150678321d	Спасибо, Торвальд!	Thank you, Torvald!
Player_200003_d5894670-6f47-4c4b-af5a-0c2e5e8e7288_0	Расскажите о себе	Tell us about yourself
Player_200003_d5894670-6f47-4c4b-af5a-0c2e5e8e7288_1	Купить товары	Buy products
Player_200003_d5894670-6f47-4c4b-af5a-0c2e5e8e7288_2	До свидания!	Goodbye!