key	ru	en
Tertilus_0_ef43fb77-8168-40e4-a6e4-0962416855d7	Ого-го, у нас тут новенький!	Wow, we have a new guy here!
Tertilus_0_ba4a9a8a-d34c-4cb1-aaf0-2ea81e21fd4b	Как тебя звать?	What is your name?
Tertilus_0_510899d8-6436-4d40-b6d3-12e2718bbc79	Меня зовут <link=hlight+wave>Тертилус!</link>	My name is <link=hlight+wave>Tertilus!</link>
Tertilus_0_30b022de-ad40-42bb-b1a0-3e2ed9f3eccb	Приятно познакомиться!	Nice to meet you!
Tertilus_0_79938c7e-15c8-4939-854c-85afcbcdaa4b	Кхм, ну немного.	Hmm, well, a little.
Tertilus_0_69066983-ac32-4049-b039-a475200362ae	Я тут собирал  <link=hlight>ракушки</link>, хо-хо, но слишком близко подплыл ко льду...	I was collecting shells here, ho-ho, but I got too close to the ice...
Tertilus_0_ff6ff07f-7501-4732-bab5-50e314a15471	Да не стои...	Don't stand there...
Tertilus_0_9e213245-706b-4a9f-bfbc-337f39378187	Ох...	Oh...
Tertilus_0_219da4a4-060d-4605-9b2b-6945c84ae31b	И правда стало телпее, малец!	And it really has become warmer, kid!
Tertilus_0_8cf0665d-b945-42ed-aa93-39f9bbf0c9ff	А всё же ракушки стоило бы собрать...	Still, it would be worth collecting the shells...
Tertilus_0_5c2a9f00-01b5-46d5-bd75-a184dadfa06e	У нас они — очень ценный ресурс!	For us they are a very valuable resource!
Tertilus_0_b07b71c7-c475-42ae-ac35-9e8022e2ec4d	Ты можешь собрать, но оставь себе.	You can collect it, but keep it for yourself.
Tertilus_0_6ded09ba-5268-4ed5-8963-828baa5fa68b	Во-о-он там впереди они есть, собери и возвращайся ко мне.	O-o-o-over there they are ahead, collect them and come back to me.
Tertilus_0_c0d6ec76-bad0-4afe-ab81-b112c7069630	Охо-хо, конечно!	Oh-ho, of course!
Tertilus_0_f43f1a35-5c4d-4679-a105-3959c9aeca94	Ракушки у нас очень давно в обиходе.	Shells have been in our everyday life for a very long time.
Tertilus_0_ab608d76-f8d6-4363-90f1-6fcc2473d581	Они добываются не самым простым способом, так ещё лёд усугубил всё.	They are not obtained in the easiest way, and the ice made everything even worse.
Tertilus_0_e4e0f82d-987c-43fe-98ba-1d83eea10e9d	Поэтому мы очень ценим этот ресурс и обмениваем  <link=hlight+wave>ценные товары</link> на него.	That's why we value this resource so much and exchange <link=hlight+wave>valuable goods</link> for it.
Tertilus_0_b1ae0652-5a91-4e85-a141-2cfbcfaf35a3	Тебе они явно нужнее, ты же новенький.	You clearly need them more, since you're new.
Tertilus_0_3fbbcb0b-f637-421a-b20c-c511fce9a5b5	Конечно.	Certainly.
Tertilus_1_3ba11b2f-826a-4851-a8ec-aaf2291fb561	Хо-хо, ну молодчина!	Ho-ho, well done!
Tertilus_1_5bfffb98-eb33-406b-b249-c415a2ad454c	{playerName}, а пошли за мной!	{playerName}, come follow me!
Tertilus_2_92b4b5db-a23c-4353-9991-fb52d757b997	Раз ты тут впервые, то я тебе всё покажу.	Since this is your first time here, I'll show you everything.
Tertilus_2_f783ea6b-f78c-4abd-aad1-9b4e90cc4490	Я не встречал таких, как ты раньше, а живу я тут очень давно!	I haven't met anyone like you before, and I've been living here for a very long time!
Tertilus_2_908e9246-44d6-46c2-895e-33b35902249c	Кстати, откуда ты, дитя?	By the way, where are you from, child?
Tertilus_2_fea430d1-da5a-43f0-83bd-de48925d7d1f	Не переживай, мы нормально относимся к чужакам.	Don't worry, we treat strangers normally.
Tertilus_2_9c0970f8-902d-4c3b-9f72-243c5ae24a73	Я тебе хотел показать преграды, которые ты можешь встретить.	I wanted to show you the obstacles you might encounter.
Tertilus_2_34240eae-781f-4365-a3c1-32158c6ce141	Например эту.	For example, this one.
Tertilus_2_99115da4-606d-4a9b-9dc0-9b16ebfe625b	Тебе нужно активировать все рычаги, некоторые из них могут быть <link=wave>замёрзшими</link>.	You need to activate all the levers, some of them may be <link=wave>frozen</link>.
Tertilus_2_df912b88-1bfc-47a4-91f3-6982ecedb048	Эти пазлы могут тебе часто встречаться в приключениях.	You may often come across these puzzles in your adventures.
Tertilus_2_aa609807-0bcb-431c-82c8-57e7be691bd5	Отлично!	Great!
Tertilus_2_b179b5b5-467e-4a4d-b9a2-b44c6b877eea	Ой, подожди, а что <link=hlight>там</link>?	Oh, wait, what's <link=hlight>there</link>?
Tertilus_2_0a9634a3-9fbc-456b-995f-08660af0cc33	Ух ты, пух ты, это же моя трость!	Oh my, that's my cane!
Tertilus_2_6ad5b9bc-6354-476d-adb6-44c0851acf44	Будь добр, малец, принеси её старцу.	Be kind, boy, and bring it to the old man.
Tertilus_3_c85969df-f76b-499c-8fb3-8e9be017196c	Спасибо большое!	Thanks a lot!
Tertilus_3_1297248e-84d9-455d-abca-cf651c1a56c3	Слушай, тебе же негде жить получается?	Listen, you have nowhere to live, don’t you?
Tertilus_3_fa47d080-3911-4fed-9fa7-974b98dd0830	<link=wave>Ох, трость, моя трость...</link>	<link=wave>Oh, my cane, my cane...</link>
Tertilus_3_aee50b61-f41c-46cf-95d3-ed9cac82c0a5	Тогда айда за мной!	Then come follow me!
Tertilus_4_194d1df4-2e11-4a54-ad17-3607a68a7a06	<link=hlight+wave>ПОЗДРАВЛЯЮ С ТВОИМ НОВЫМ ДОМОМ!</link>	<link=hlight+wave>CONGRATULATIONS ON YOUR NEW HOME!</link>
Tertilus_4_72ddf36f-b9a8-4cfa-8229-e4a5a5fc62d8	Да не переживай ты, тут всё равно никто не живёт.	Don't worry, no one lives here anyway.
Tertilus_4_56c03de2-db23-4feb-823b-44812f539a79	Ты уже мне помог, этого достаточно!	You've already helped me, that's enough!
Tertilus_4_6be281bc-d7a4-4dba-8ac0-58f96b8c692f	Пойдём лучше внутрь.	Let's go inside instead.
Tertilus_5_93e04ab6-59a4-4b34-90b4-c60066777d5a	Это ещё маленький, у нас тут в <link=hlight>Большом Рифе</link> есть много разных домов.	This is still small, we have many different houses here in <link=hlight>Big Reef</link>.
Tertilus_5_2de54015-fa4b-43ec-ad3e-6f0ff67515a9	{playerName}, я смотрю, у тебя уже есть предметы.	{playerName}, I see you already have the items.
Tertilus_5_7d1fe586-0194-467d-99f1-40dd8cc77f87	{playerName}, держи от меня подарок!	{playerName}, here's a gift from me!
Tertilus_5_957f0eec-ecfa-4e3b-894d-3e50cdbee37b	Ты можешь использовать такие предметы для декорации дома!	You can use such items to decorate your home!
Tertilus_5_2689f594-9c4c-41aa-9701-111a3b16a215	Попробуй, я уверен у тебя получится сделать его действительно уютным!	Try it, I'm sure you'll be able to make it really cozy!
Tertilus_5_80f53437-d2b3-41e1-b604-84b26f0b9fec	А мне пора бежать, до скорых встреч, хо-хо-хо!	And I have to run, see you soon, ho-ho-ho!
Tertilus_10_f15d3697-0a4a-4e46-b08a-116218f35878	В молодости я был активным, жизнерадостным...	In my youth I was active, cheerful...
Tertilus_10_90a8235d-dbb8-4429-b29a-05b0f79bad84	Я собирал партию, избирался.	I was gathering a party and getting elected.
Tertilus_10_19fb302e-2014-439a-bcff-553970fac49b	Меня все слушали и поддерживали.	Everyone listened to me and supported me.
Tertilus_10_1e6b9fbb-e9b9-429f-9ffb-11ab4f63542d	Но шло время и я всё отдалялся от молодёжи, утопал в делах.	But time passed and I became more and more distant from the youth and became immersed in my work.
Tertilus_10_2b85dd50-26a5-415e-bef4-5934d219de23	Я становился типичным взрослым.	I was becoming a typical adult.
Tertilus_10_fa82ebc2-9b79-4758-9e82-18cb955dd8f2	А потом и вовсе забыл про то, что когда-то был ребёнком.	And then I completely forgot that I was once a child.
Tertilus_10_766f7964-7d4e-4fbf-a11c-7ac93dc89fe0	Но когда говорят мой возраст или называют старым...	But when they talk about my age or call me old...
Tertilus_10_f092e547-c9ca-4cf5-971f-6cbb13af6d34	Мне становится не по себе.	I feel uneasy.
Tertilus_10_e9ac5079-4df4-4770-b95b-7d7d2787c378	К сожалению, ничто не вечно.	Unfortunately, nothing lasts forever.
Tertilus_11_5e47b56d-2e22-4e10-988d-b362a26d9574	Ох, ребята...	Oh, guys...
Tertilus_11_26bb7790-357f-4ab4-ac14-bd61d4963b42	Где я?	Where am I?
Tertilus_11_bf235542-d715-4f78-867d-45fb2835a5c9	Главное, что всё обошлось, ребятки.	The main thing is that everything worked out, guys.
Tertilus_11_e1075c0a-56e9-428e-8292-b358093edcbb	И то верно, хо-хо!	And that’s true, ho-ho!